{
  "$schema": "https://json-schema.org/draft/2020-12/schema",
  "$id": "https://github.com/atongrun/health-bridge/contracts/query-response.schema.json",
  "title": "Read-only health query response (shortcuts-1, design)",
  "type": "object",
  "additionalProperties": false,
  "properties": {
    "schema_version": {
      "const": "1"
    },
    "data": {
      "type": "array",
      "items": {
        "type": "object",
        "additionalProperties": false,
        "properties": {
          "kind": {
            "enum": [
              "daily",
              "quantity",
              "sleep",
              "workout"
            ]
          },
          "daily": {
            "$ref": "#/$defs/daily"
          },
          "quantity": {
            "$ref": "#/$defs/quantity"
          },
          "sleep": {
            "$ref": "#/$defs/sleep"
          },
          "workout": {
            "$ref": "#/$defs/workout"
          }
        },
        "required": [
          "kind"
        ],
        "allOf": [
          {
            "if": {
              "properties": {
                "kind": {
                  "const": "daily"
                }
              }
            },
            "then": {
              "required": [
                "daily"
              ],
              "not": {
                "anyOf": [
                  {
                    "required": [
                      "quantity"
                    ]
                  },
                  {
                    "required": [
                      "sleep"
                    ]
                  },
                  {
                    "required": [
                      "workout"
                    ]
                  }
                ]
              }
            }
          },
          {
            "if": {
              "properties": {
                "kind": {
                  "const": "quantity"
                }
              }
            },
            "then": {
              "required": [
                "quantity"
              ],
              "not": {
                "anyOf": [
                  {
                    "required": [
                      "daily"
                    ]
                  },
                  {
                    "required": [
                      "sleep"
                    ]
                  },
                  {
                    "required": [
                      "workout"
                    ]
                  }
                ]
              }
            }
          },
          {
            "if": {
              "properties": {
                "kind": {
                  "const": "sleep"
                }
              }
            },
            "then": {
              "required": [
                "sleep"
              ],
              "not": {
                "anyOf": [
                  {
                    "required": [
                      "daily"
                    ]
                  },
                  {
                    "required": [
                      "quantity"
                    ]
                  },
                  {
                    "required": [
                      "workout"
                    ]
                  }
                ]
              }
            }
          },
          {
            "if": {
              "properties": {
                "kind": {
                  "const": "workout"
                }
              }
            },
            "then": {
              "required": [
                "workout"
              ],
              "not": {
                "anyOf": [
                  {
                    "required": [
                      "daily"
                    ]
                  },
                  {
                    "required": [
                      "quantity"
                    ]
                  },
                  {
                    "required": [
                      "sleep"
                    ]
                  }
                ]
              }
            }
          }
        ]
      },
      "maxItems": 1000
    },
    "next_cursor": {
      "oneOf": [
        {
          "type": "string",
          "maxLength": 256
        },
        {
          "type": "null"
        }
      ]
    },
    "truncated": {
      "type": "boolean"
    },
    "quality": {
      "$ref": "#/$defs/quality"
    },
    "range": {
      "type": "object",
      "additionalProperties": false,
      "properties": {
        "start_date": {
          "type": "string",
          "pattern": "^\\d{4}-\\d{2}-\\d{2}$"
        },
        "end_date": {
          "type": "string",
          "pattern": "^\\d{4}-\\d{2}-\\d{2}$"
        }
      },
      "required": [
        "start_date",
        "end_date"
      ]
    },
    "timezone": {
      "type": "string",
      "pattern": "^[A-Za-z0-9_+\\-]+(/[A-Za-z0-9_+\\-]+)*$",
      "minLength": 1,
      "maxLength": 64
    }
  },
  "required": [
    "schema_version",
    "data",
    "next_cursor",
    "truncated",
    "quality",
    "range",
    "timezone"
  ],
  "$defs": {
    "date": {
      "type": "string",
      "pattern": "^\\d{4}-\\d{2}-\\d{2}$"
    },
    "datetime": {
      "type": "string",
      "format": "date-time",
      "pattern": "^\\d{4}-\\d{2}-\\d{2}T\\d{2}:\\d{2}:\\d{2}(\\.\\d{1,6})?(Z|[+-]\\d{2}:\\d{2})$"
    },
    "unit": {
      "type": "string",
      "minLength": 1,
      "maxLength": 32
    },
    "nullable_number": {
      "oneOf": [
        {
          "type": "number"
        },
        {
          "type": "null"
        }
      ]
    },
    "nullable_nonnegative_number": {
      "oneOf": [
        {
          "type": "number",
          "minimum": 0
        },
        {
          "type": "null"
        }
      ]
    },
    "daily": {
      "type": "object",
      "additionalProperties": false,
      "properties": {
        "day": {
          "$ref": "#/$defs/date"
        },
        "metric": {
          "$ref": "https://github.com/atongrun/health-bridge/contracts/shortcuts-observation.schema.json#/properties/metric"
        },
        "unit": {
          "$ref": "#/$defs/unit"
        },
        "min": {
          "$ref": "#/$defs/nullable_number"
        },
        "mean": {
          "$ref": "#/$defs/nullable_number"
        },
        "max": {
          "$ref": "#/$defs/nullable_number"
        },
        "sum": {
          "$ref": "#/$defs/nullable_number"
        },
        "latest": {
          "oneOf": [
            {
              "type": "null"
            },
            {
              "type": "object",
              "additionalProperties": false,
              "properties": {
                "value": {
                  "type": "number"
                },
                "measured_at": {
                  "$ref": "#/$defs/datetime"
                }
              },
              "required": [
                "value",
                "measured_at"
              ]
            }
          ]
        },
        "n": {
          "type": "integer",
          "minimum": 0
        },
        "quality": {
          "$ref": "#/$defs/quality"
        }
      },
      "required": [
        "day",
        "metric",
        "unit",
        "min",
        "mean",
        "max",
        "sum",
        "latest",
        "n",
        "quality"
      ]
    },
    "quantity": {
      "type": "object",
      "additionalProperties": false,
      "properties": {
        "start": {
          "$ref": "#/$defs/datetime"
        },
        "end": {
          "oneOf": [
            {
              "$ref": "#/$defs/datetime"
            },
            {
              "type": "null"
            }
          ]
        },
        "value": {
          "type": "number"
        },
        "unit": {
          "$ref": "#/$defs/unit"
        },
        "time_precision": {
          "enum": [
            "second",
            "millisecond",
            "microsecond",
            "unknown"
          ]
        }
      },
      "required": [
        "start",
        "end",
        "value",
        "unit",
        "time_precision"
      ]
    },
    "sleep": {
      "type": "object",
      "additionalProperties": false,
      "properties": {
        "start": {
          "$ref": "#/$defs/datetime"
        },
        "end": {
          "$ref": "#/$defs/datetime"
        },
        "stage": {
          "type": "string",
          "minLength": 1,
          "maxLength": 64
        }
      },
      "required": [
        "start",
        "end",
        "stage"
      ]
    },
    "workout": {
      "type": "object",
      "additionalProperties": false,
      "properties": {
        "observation_id": {
          "type": "string",
          "pattern": "^[0-9a-f]{8}-[0-9a-f]{4}-[0-9a-f]{4}-[0-9a-f]{4}-[0-9a-f]{12}$",
          "format": "uuid"
        },
        "start": {
          "$ref": "#/$defs/datetime"
        },
        "end": {
          "oneOf": [
            {
              "$ref": "#/$defs/datetime"
            },
            {
              "type": "null"
            }
          ]
        },
        "activity": {
          "type": "string",
          "minLength": 1,
          "maxLength": 64
        },
        "duration_seconds": {
          "$ref": "#/$defs/nullable_nonnegative_number"
        },
        "active_energy_kcal": {
          "$ref": "#/$defs/nullable_nonnegative_number"
        },
        "distance_m": {
          "$ref": "#/$defs/nullable_nonnegative_number"
        },
        "average_heart_rate_bpm": {
          "$ref": "#/$defs/nullable_nonnegative_number"
        },
        "maximum_heart_rate_bpm": {
          "$ref": "#/$defs/nullable_nonnegative_number"
        }
      },
      "required": [
        "observation_id",
        "start",
        "end",
        "activity",
        "duration_seconds",
        "active_energy_kcal",
        "distance_m",
        "average_heart_rate_bpm",
        "maximum_heart_rate_bpm"
      ]
    },
    "quality": {
      "type": "object",
      "additionalProperties": false,
      "properties": {
        "status": {
          "enum": [
            "observed_partial",
            "no_visible_data",
            "stale",
            "pending",
            "blocked",
            "unsupported"
          ]
        },
        "collection_method": {
          "const": "shortcuts_window_observation"
        },
        "identity_quality": {
          "enum": [
            "unverified",
            "native_id_verified"
          ]
        },
        "source_quality": {
          "enum": [
            "unknown",
            "label_only",
            "filtered_verified"
          ]
        },
        "window_coverage": {
          "type": "object",
          "additionalProperties": false,
          "properties": {
            "observed_windows": {
              "type": "integer",
              "minimum": 0
            },
            "expected_windows": {
              "type": "integer",
              "minimum": 0
            }
          },
          "required": [
            "observed_windows",
            "expected_windows"
          ]
        },
        "last_observed_at": {
          "oneOf": [
            {
              "$ref": "#/$defs/datetime"
            },
            {
              "type": "null"
            }
          ]
        },
        "last_attempt_at": {
          "oneOf": [
            {
              "$ref": "#/$defs/datetime"
            },
            {
              "type": "null"
            }
          ]
        },
        "method_version": {
          "type": "string",
          "minLength": 1,
          "maxLength": 32
        },
        "limitations": {
          "type": "array",
          "items": {
            "type": "string",
            "minLength": 1,
            "maxLength": 256
          }
        }
      },
      "required": [
        "status",
        "collection_method",
        "identity_quality",
        "source_quality",
        "window_coverage",
        "last_observed_at",
        "last_attempt_at",
        "method_version",
        "limitations"
      ]
    }
  }
}
